{
  "surface_kind": "opl_work_order_materialization_request",
  "version": "opl-work-order-materialization-request.v2",
  "canonical_schema_ref": "contracts/opl-framework/work-order-materialization-request.schema.json",
  "request_kind": "foundry_evaluation",
  "request_owner": "oma",
  "producer_agent_id": "oma",
  "execution_owner": "one-person-lab/OPL Foundry Lab",
  "target_agent": {
    "domain_id": "example-agent",
    "repo_dir": "/tmp/example-agent",
    "target_agent_ref": "domain-agent:example-agent",
    "descriptor_ref": "/tmp/example-agent/contracts/domain_descriptor.json"
  },
  "semantic_request": {
    "request_id": "foundry-evaluation-request:example-agent/baseline",
    "suite_id": "foundry-suite:example-agent/baseline",
    "suite_kind": "agent_lab_external_suite",
    "task_intents": [
      {
        "task_id": "task:example-agent/baseline",
        "domain_id": "opl-meta-agent",
        "task_family": "agent_baseline_evaluation",
        "instructions_ref": "instructions:example-agent/baseline",
        "agent_entry_ref": "agent-entry:example-agent/default",
        "stage_refs": ["stage:example-agent/baseline"],
        "oracle_refs": ["oracle:example-agent/baseline"],
        "scorer_refs": ["scorer:example-agent/baseline"],
        "metric_refs": ["metric:example-agent/baseline"],
        "evidence_refs": ["evidence:example-agent/baseline"],
        "review_refs": ["review:example-agent/baseline"],
        "quality_gate_refs": ["quality-gate:example-agent/baseline"],
        "trajectory_ref": "trajectory:example-agent/baseline",
        "requested_run_ref": "requested-run:example-agent/baseline",
        "artifact_refs": ["artifact:example-agent/baseline"],
        "receipt_refs": ["expected-owner-receipt:example-agent/baseline"],
        "scorecard_ref": "scorecard:example-agent/baseline",
        "improvement_candidate": {
          "candidate_ref": "candidate:example-agent/baseline",
          "candidate_kind": "agent_baseline",
          "target_ref": "quality-gate:example-agent/baseline",
          "allowed_change_scope": "branch_only"
        },
        "promotion_gate_ref": "promotion-gate:example-agent/baseline"
      }
    ],
    "source_refs": ["source:example-agent/descriptor"],
    "reviewer_refs": ["reviewer:example-agent/independent"],
    "candidate_refs": ["candidate:example-agent/baseline"]
  },
  "authority_boundary": {
    "semantic_scope": "agent_building_request_only",
    "work_order_materialization_owner": "one-person-lab/OPL Foundry Lab",
    "work_order_lifecycle_owner": "one-person-lab/OPL Foundry Lab",
    "target_worktree_lifecycle_owner": "one-person-lab/OPL Foundry Lab",
    "target_owner_closeout_owner": "target-domain",
    "producer_writes_framework_request_bundle": false,
    "producer_assigns_work_order_id": false,
    "producer_manages_executor_lease": false,
    "producer_manages_target_worktree": false,
    "producer_executes_work_order": false,
    "producer_writes_work_order_receipt": false,
    "producer_writes_target_owner_closeout": false
  }
}
