{
  "surface_kind": "opl_work_order_materialization_request",
  "version": "opl-work-order-materialization-request.v2",
  "canonical_schema_ref": "contracts/opl-framework/work-order-materialization-request.schema.json",
  "request_kind": "developer_patch",
  "request_owner": "oma",
  "producer_agent_id": "oma",
  "execution_owner": "one-person-lab/OPL Foundry Lab",
  "target_agent": {
    "domain_id": "example-agent",
    "repo_dir": "/tmp/example-agent",
    "target_agent_ref": "domain-agent:example-agent",
    "descriptor_ref": "/tmp/example-agent/contracts/domain_descriptor.json"
  },
  "semantic_request": {
    "request_id": "developer-patch-request:example-agent/quality-gap",
    "source_agent_lab_result_ref": "agent-lab-result:example-agent/quality-gap",
    "foundry_lab_execution_receipt_ref": "foundry-lab-receipt:example-agent/quality-gap",
    "agent_building_judgment": {
      "target_capability_improvement_candidate_ref": "candidate:example-agent/quality-gap",
      "root_cause": "The target quality gate does not reject the observed evidence gap.",
      "targeted_fix": ["quality-gate:example-agent/evidence-integrity"],
      "predicted_impact": "The target agent rejects unsupported claims while preserving target-domain authority.",
      "failure_class": "quality-gate",
      "source_morphology_proof_ref": "source-morphology-proof:example-agent/quality-gap",
      "private_residue_decision_ref": "private-residue-decision:example-agent/quality-gap",
      "target_runtime_read_model_consumption_ref": "target-runtime-read-model-consumption:example-agent/quality-gap",
      "failure_evidence_refs": ["evidence:example-agent/unsupported-claim"],
      "target_editable_surface_refs": ["agent/quality_gates/evidence-integrity.md"],
      "forbidden_surfaces": ["target domain truth surfaces"],
      "expected_behavior_delta": "Reject the unsupported claim and return the target-owned repair route.",
      "verification_refs": ["test:example-agent/evidence-integrity"],
      "reviewer_refs": ["reviewer:example-agent/independent"],
      "owner_route_refs": ["owner-route:example-agent/quality-owner"],
      "no_forbidden_write_proof_refs": ["no-forbidden-write:example-agent/quality-gap"],
      "patch_traceability_refs": ["patch-traceability:example-agent/quality-gap"]
    },
    "source_refs": ["source:example-agent/quality-gap"],
    "reviewer_refs": ["reviewer:example-agent/independent"],
    "candidate_refs": ["candidate:example-agent/quality-gap"]
  },
  "authority_boundary": {
    "semantic_scope": "agent_building_request_only",
    "work_order_materialization_owner": "one-person-lab/OPL Foundry Lab",
    "work_order_lifecycle_owner": "one-person-lab/OPL Foundry Lab",
    "target_worktree_lifecycle_owner": "one-person-lab/OPL Foundry Lab",
    "target_owner_closeout_owner": "target-domain",
    "producer_writes_framework_request_bundle": false,
    "producer_assigns_work_order_id": false,
    "producer_manages_executor_lease": false,
    "producer_manages_target_worktree": false,
    "producer_executes_work_order": false,
    "producer_writes_work_order_receipt": false,
    "producer_writes_target_owner_closeout": false
  }
}
